{
  "schema": "nib.run.v1",
  "id": "contract-3f3faddac6d846af",
  "atlas_revision": "unpublished",
  "status": "ingested",
  "data": {
    "id": "sevir",
    "version": "1.0.0"
  },
  "sample": {
    "sample_id": "S696651@2017-06-27T00:35:00Z",
    "event_id": "S696651",
    "row": 0,
    "context_start_time": "2017-06-27T00:35:00Z",
    "init_time": "2017-06-27T01:00:00Z"
  },
  "observations": {
    "context": {
      "path": "inputs/context.npz",
      "sha256": "06359a8da0194c5b2c721302fc62fc25e648f1ddf412a7f44245cc4b89a282fc",
      "shape": [
        6,
        128,
        128
      ],
      "dtype": "float32",
      "variable": "vil",
      "unit": "raw",
      "times": [
        "2017-06-27T00:35:00Z",
        "2017-06-27T00:40:00Z",
        "2017-06-27T00:45:00Z",
        "2017-06-27T00:50:00Z",
        "2017-06-27T00:55:00Z",
        "2017-06-27T01:00:00Z"
      ],
      "grid": {
        "crs": "PROJCRS[\"unknown\",BASEGEOGCRS[\"unknown\",DATUM[\"Unknown based on Normal Sphere (r=6370997) ellipsoid\",ELLIPSOID[\"Normal Sphere (r=6370997)\",6370997,0,LENGTHUNIT[\"metre\",1,ID[\"EPSG\",9001]]]],PRIMEM[\"Greenwich\",0,ANGLEUNIT[\"degree\",0.0174532925199433],ID[\"EPSG\",8901]]],CONVERSION[\"unknown\",METHOD[\"Lambert Azimuthal Equal Area (Spherical)\",ID[\"EPSG\",1027]],PARAMETER[\"Latitude of natural origin\",38,ANGLEUNIT[\"degree\",0.0174532925199433],ID[\"EPSG\",8801]],PARAMETER[\"Longitude of natural origin\",-98,ANGLEUNIT[\"degree\",0.0174532925199433],ID[\"EPSG\",8802]],PARAMETER[\"False easting\",0,LENGTHUNIT[\"metre\",1],ID[\"EPSG\",8806]],PARAMETER[\"False northing\",0,LENGTHUNIT[\"metre\",1],ID[\"EPSG\",8807]]],CS[Cartesian,2],AXIS[\"(E)\",east,ORDER[1],LENGTHUNIT[\"metre\",1,ID[\"EPSG\",9001]]],AXIS[\"(N)\",north,ORDER[2],LENGTHUNIT[\"metre\",1,ID[\"EPSG\",9001]]]]",
        "axis_units": "m",
        "source": "CATALOG.csv + align_corners=False pixel mapping",
        "native_shape": [
          384,
          384
        ],
        "missing_policy": "reject_pct_missing_nonzero"
      }
    },
    "target": {
      "path": "inputs/target.npz",
      "sha256": "fc9ca7b1ac561bf0a4ac5d2a8f455c372d89ef297e1e4b0e010e97863aa883b7",
      "shape": [
        20,
        128,
        128
      ],
      "dtype": "float32",
      "variable": "vil",
      "unit": "raw",
      "times": [
        "2017-06-27T01:05:00Z",
        "2017-06-27T01:10:00Z",
        "2017-06-27T01:15:00Z",
        "2017-06-27T01:20:00Z",
        "2017-06-27T01:25:00Z",
        "2017-06-27T01:30:00Z",
        "2017-06-27T01:35:00Z",
        "2017-06-27T01:40:00Z",
        "2017-06-27T01:45:00Z",
        "2017-06-27T01:50:00Z",
        "2017-06-27T01:55:00Z",
        "2017-06-27T02:00:00Z",
        "2017-06-27T02:05:00Z",
        "2017-06-27T02:10:00Z",
        "2017-06-27T02:15:00Z",
        "2017-06-27T02:20:00Z",
        "2017-06-27T02:25:00Z",
        "2017-06-27T02:30:00Z",
        "2017-06-27T02:35:00Z",
        "2017-06-27T02:40:00Z"
      ],
      "grid": {
        "crs": "PROJCRS[\"unknown\",BASEGEOGCRS[\"unknown\",DATUM[\"Unknown based on Normal Sphere (r=6370997) ellipsoid\",ELLIPSOID[\"Normal Sphere (r=6370997)\",6370997,0,LENGTHUNIT[\"metre\",1,ID[\"EPSG\",9001]]]],PRIMEM[\"Greenwich\",0,ANGLEUNIT[\"degree\",0.0174532925199433],ID[\"EPSG\",8901]]],CONVERSION[\"unknown\",METHOD[\"Lambert Azimuthal Equal Area (Spherical)\",ID[\"EPSG\",1027]],PARAMETER[\"Latitude of natural origin\",38,ANGLEUNIT[\"degree\",0.0174532925199433],ID[\"EPSG\",8801]],PARAMETER[\"Longitude of natural origin\",-98,ANGLEUNIT[\"degree\",0.0174532925199433],ID[\"EPSG\",8802]],PARAMETER[\"False easting\",0,LENGTHUNIT[\"metre\",1],ID[\"EPSG\",8806]],PARAMETER[\"False northing\",0,LENGTHUNIT[\"metre\",1],ID[\"EPSG\",8807]]],CS[Cartesian,2],AXIS[\"(E)\",east,ORDER[1],LENGTHUNIT[\"metre\",1,ID[\"EPSG\",9001]]],AXIS[\"(N)\",north,ORDER[2],LENGTHUNIT[\"metre\",1,ID[\"EPSG\",9001]]]]",
        "axis_units": "m",
        "source": "CATALOG.csv + align_corners=False pixel mapping",
        "native_shape": [
          384,
          384
        ],
        "missing_policy": "reject_pct_missing_nonzero"
      }
    }
  },
  "forecasts": {},
  "diagnostics": []
}
